[
  {
    "providerId": "11111111-1111-1111-1111-111111111111",
    "displayName": "Rahim Uddin",
    "verified": true,
    "skills": ["plumbing", "electrical"],
    "languages": ["bn", "en"],
    "available": true,
    "latitude": 23.7465,
    "longitude": 90.3760,
    "serviceRadiusKm": 15,
    "activeJobs": 0,
    "maxConcurrentJobs": 3,
    "averageRating": 4.7,
    "reviewCount": 32,
    "completionRate": 0.96,
    "cancellationRate": 0.03,
    "medianResponseMinutes": 18
  },
  {
    "providerId": "11111111-1111-1111-1111-111111111119",
    "displayName": "Tariq Mahmud",
    "verified": true,
    "skills": ["plumbing", "pipe_fitting"],
    "languages": ["bn"],
    "available": true,
    "latitude": 23.7460,
    "longitude": 90.4180,
    "serviceRadiusKm": 12,
    "activeJobs": 0,
    "maxConcurrentJobs": 2,
    "averageRating": 4.4,
    "reviewCount": 8,
    "completionRate": 0.91,
    "cancellationRate": 0.05,
    "medianResponseMinutes": 24
  },
  {
    "providerId": "11111111-1111-1111-1111-111111111117",
    "displayName": "Biplob Sarker",
    "verified": true,
    "skills": ["electrical"],
    "languages": ["bn", "en"],
    "available": true,
    "latitude": 23.7630,
    "longitude": 90.4010,
    "serviceRadiusKm": 18,
    "activeJobs": 1,
    "maxConcurrentJobs": 3,
    "averageRating": 4.8,
    "reviewCount": 44,
    "completionRate": 0.97,
    "cancellationRate": 0.02,
    "medianResponseMinutes": 15
  },
  {
    "providerId": "11111111-1111-1111-1111-111111111116",
    "displayName": "Naim Islam",
    "verified": true,
    "skills": ["cleaning", "general_repair"],
    "languages": ["bn", "en"],
    "available": true,
    "latitude": 23.7580,
    "longitude": 90.3580,
    "serviceRadiusKm": 16,
    "activeJobs": 1,
    "maxConcurrentJobs": 4,
    "averageRating": 4.5,
    "reviewCount": 21,
    "completionRate": 0.94,
    "cancellationRate": 0.04,
    "medianResponseMinutes": 25
  },
  {
    "providerId": "11111111-1111-1111-1111-111111111113",
    "displayName": "Jamal Ahmed",
    "verified": true,
    "skills": ["painting"],
    "languages": ["bn", "en"],
    "available": true,
    "latitude": 23.8759,
    "longitude": 90.3795,
    "serviceRadiusKm": 25,
    "activeJobs": 1,
    "maxConcurrentJobs": 3,
    "averageRating": 4.4,
    "reviewCount": 12,
    "completionRate": 0.91,
    "cancellationRate": 0.06,
    "medianResponseMinutes": 35
  },
  {
    "providerId": "11111111-1111-1111-1111-111111111121",
    "displayName": "Farhan Kabir",
    "verified": true,
    "skills": ["electrical", "plumbing"],
    "languages": ["bn", "en"],
    "available": true,
    "latitude": 23.7920,
    "longitude": 90.4100,
    "serviceRadiusKm": 18,
    "activeJobs": 0,
    "maxConcurrentJobs": 3,
    "averageRating": 4.6,
    "reviewCount": 27,
    "completionRate": 0.94,
    "cancellationRate": 0.04,
    "medianResponseMinutes": 20
  },
  {
    "providerId": "11111111-1111-1111-1111-111111111122",
    "displayName": "Ayesha Rahman",
    "verified": true,
    "skills": ["electrical", "plumbing"],
    "languages": ["bn", "en"],
    "available": true,
    "latitude": 23.7810,
    "longitude": 90.3980,
    "serviceRadiusKm": 20,
    "activeJobs": 1,
    "maxConcurrentJobs": 4,
    "averageRating": 4.7,
    "reviewCount": 36,
    "completionRate": 0.95,
    "cancellationRate": 0.03,
    "medianResponseMinutes": 17
  },
  {
    "providerId": "11111111-1111-1111-1111-111111111123",
    "displayName": "Imran Hossain",
    "verified": true,
    "skills": ["electrical", "plumbing"],
    "languages": ["bn", "en"],
    "available": true,
    "latitude": 23.7700,
    "longitude": 90.3900,
    "serviceRadiusKm": 16,
    "activeJobs": 0,
    "maxConcurrentJobs": 2,
    "averageRating": 4.3,
    "reviewCount": 14,
    "completionRate": 0.90,
    "cancellationRate": 0.06,
    "medianResponseMinutes": 28
  }
]
