[
  {
    "providerId": "provider-plumbing-a",
    "displayName": "Rahim Plumbing",
    "verified": true,
    "skills": ["plumbing"],
    "languages": ["bn", "en"],
    "available": true,
    "latitude": 23.7820,
    "longitude": 90.4090,
    "serviceRadiusKm": 15,
    "activeJobs": 0,
    "maxConcurrentJobs": 3,
    "averageRating": 4.7,
    "reviewCount": 32,
    "completionRate": 0.96,
    "cancellationRate": 0.03,
    "medianResponseMinutes": 18
  },
  {
    "providerId": "provider-plumbing-new",
    "displayName": "Karim Repairs",
    "verified": true,
    "skills": ["plumbing"],
    "languages": ["bn"],
    "available": true,
    "latitude": 23.7850,
    "longitude": 90.4100,
    "serviceRadiusKm": 12,
    "activeJobs": 0,
    "maxConcurrentJobs": 2,
    "averageRating": 5.0,
    "reviewCount": 1,
    "completionRate": 0.90,
    "cancellationRate": 0.05,
    "medianResponseMinutes": 12
  },
  {
    "providerId": "provider-plumbing-unverified",
    "displayName": "Unverified Plumber",
    "verified": false,
    "skills": ["plumbing"],
    "languages": ["bn"],
    "available": true,
    "latitude": 23.7810,
    "longitude": 90.4080,
    "serviceRadiusKm": 20,
    "activeJobs": 0,
    "maxConcurrentJobs": 4,
    "averageRating": 5.0,
    "reviewCount": 50,
    "completionRate": 1.0,
    "cancellationRate": 0.0,
    "medianResponseMinutes": 5
  },
  {
    "providerId": "provider-electrical-a",
    "displayName": "Nadia Electrical",
    "verified": true,
    "skills": ["electrical"],
    "languages": ["bn", "en"],
    "available": true,
    "latitude": 23.7790,
    "longitude": 90.4040,
    "serviceRadiusKm": 18,
    "activeJobs": 1,
    "maxConcurrentJobs": 3,
    "averageRating": 4.8,
    "reviewCount": 44,
    "completionRate": 0.97,
    "cancellationRate": 0.02,
    "medianResponseMinutes": 15
  },
  {
    "providerId": "provider-cleaning-a",
    "displayName": "Dhaka Clean Team",
    "verified": true,
    "skills": ["cleaning"],
    "languages": ["bn", "en"],
    "available": true,
    "latitude": 23.7830,
    "longitude": 90.4060,
    "serviceRadiusKm": 10,
    "activeJobs": 1,
    "maxConcurrentJobs": 5,
    "averageRating": 4.5,
    "reviewCount": 21,
    "completionRate": 0.94,
    "cancellationRate": 0.04,
    "medianResponseMinutes": 25
  },
  {
    "providerId": "provider-appliance-a",
    "displayName": "Rupa Appliance Care",
    "verified": true,
    "skills": ["appliance_repair"],
    "languages": ["bn", "en"],
    "available": true,
    "latitude": 23.7760,
    "longitude": 90.4050,
    "serviceRadiusKm": 20,
    "activeJobs": 0,
    "maxConcurrentJobs": 2,
    "averageRating": 4.6,
    "reviewCount": 18,
    "completionRate": 0.93,
    "cancellationRate": 0.04,
    "medianResponseMinutes": 30
  },
  {
    "providerId": "provider-painting-a",
    "displayName": "Colour Works",
    "verified": true,
    "skills": ["painting"],
    "languages": ["bn", "en"],
    "available": true,
    "latitude": 23.7880,
    "longitude": 90.4000,
    "serviceRadiusKm": 25,
    "activeJobs": 1,
    "maxConcurrentJobs": 3,
    "averageRating": 4.4,
    "reviewCount": 12,
    "completionRate": 0.91,
    "cancellationRate": 0.06,
    "medianResponseMinutes": 35
  },
  {
    "providerId": "provider-multiskill-overloaded",
    "displayName": "Busy Multi Service",
    "verified": true,
    "skills": ["plumbing", "electrical", "cleaning", "appliance_repair", "painting"],
    "languages": ["bn", "en"],
    "available": true,
    "latitude": 23.7800,
    "longitude": 90.4070,
    "serviceRadiusKm": 30,
    "activeJobs": 3,
    "maxConcurrentJobs": 3,
    "averageRating": 4.9,
    "reviewCount": 80,
    "completionRate": 0.98,
    "cancellationRate": 0.01,
    "medianResponseMinutes": 8
  },
  {
    "providerId": "provider-plumbing-far",
    "displayName": "Far Plumbing",
    "verified": true,
    "skills": ["plumbing"],
    "languages": ["bn"],
    "available": true,
    "latitude": 24.3636,
    "longitude": 88.6241,
    "serviceRadiusKm": 20,
    "activeJobs": 0,
    "maxConcurrentJobs": 2,
    "averageRating": 4.9,
    "reviewCount": 40,
    "completionRate": 0.97,
    "cancellationRate": 0.02,
    "medianResponseMinutes": 10
  }
]
